<?xml version="1.0" encoding="UTF-8"?>
<xs:schema xmlns:xs="http://www.w3.org/2001/XMLSchema" elementFormDefault="qualified">
    <xs:element name="libros">
        <xs:complexType>
            <xs:sequence>
                <xs:element name="libro" maxOccurs="unbounded">
                    <xs:complexType>
                        <xs:sequence>
                            <xs:element name="codigo">
                                <xs:simpleType>
                                    <xs:restriction base="xs:string">
                                        <xs:pattern value="[TPNH]\d{3}"/>
                                    </xs:restriction>
                                </xs:simpleType>
                            </xs:element>
                            <xs:element name="categoria">
                                <xs:simpleType>
                                    <xs:restriction base="xs:string">
                                        <xs:enumeration value="Teatro"/>
                                        <xs:enumeration value="PoesÃ­a"/>
                                        <xs:enumeration value="Novela"/>
                                        <xs:enumeration value="Historia"/>
                                    </xs:restriction>
                                </xs:simpleType>
                            </xs:element>
                            <xs:element name="titulo" type="xs:string" />
                            <xs:element name="autores">
                                <xs:complexType>
                                    <xs:sequence>
                                        <xs:element name="autor" maxOccurs="unbounded">
                                            <xs:complexType>
                                                <xs:sequence>
                                                    <xs:element name="nombre" type="xs:string"/>
                                                    <xs:element name="apellidos" type="xs:string"/>
                                                    <xs:element name="pseudonimo" type="xs:string" minOccurs="0"/>
                                                </xs:sequence>
                                            </xs:complexType>
                                        </xs:element>
                                    </xs:sequence>
                                </xs:complexType>
                            </xs:element>
                            <xs:element name="num_paginas" type="xs:integer" />
                            <xs:element name="anio_publicacion" type="xs:gYear" />
                        </xs:sequence>
                    </xs:complexType>
                </xs:element>
            </xs:sequence>
        </xs:complexType>
    </xs:element>
</xs:schema>